ID,post_title,post_content,post_excerpt
69169,"WESTSIDE","Westside es un conjunto de sofás contemporáneo y multifuncional que redefine con elegancia la experiencia de la sala de estar. Los módulos tapizados pueden colocarse uno al lado del otro para crear las más diversas configuraciones –desde la isla de doble cara hasta el clásico sofá esquinero–, mientras que elementos como la «chaise longue» ergonómica, el respaldo móvil y las mesitas refuerzan la funcionalidad. Un arquetipo de convivencia para diseñarlo y vivirlo con libertad.","Westside es un conjunto de sofás contemporáneo y multifuncional que redefine con elegancia la experiencia de la sala de estar. Los módulos tapizados pueden colocarse uno al lado del otro para crear las más diversas configuraciones –desde la isla de doble cara hasta el clásico sofá esquinero–, mientras que elementos como la «chaise longue» ergonómica, el respaldo móvil y las mesitas refuerzan la funcionalidad. Un arquetipo de convivencia para diseñarlo y vivirlo con libertad."
69220,"GASTON","Lineal y esencial, el sillón Gaston evoca un estilo exclusivo y lo confirma mediante detalles como el reducido grosor de la estructura metálica, las costuras y el tapizado del fino y cómodo reposabrazos. Disponible con tapicería de cuero o de tela, Gastón amuebla con elegancia las zonas de estar y los dormitorios.","Lineal y esencial, el sillón Gaston evoca un estilo exclusivo y lo confirma mediante detalles como el reducido grosor de la estructura metálica, las costuras y el tapizado del fino y cómodo reposabrazos. Disponible con tapicería de cuero o de tela, Gastón amuebla con elegancia las zonas de estar y los dormitorios."
69256,"MAD CHAIR","La colección Mad ha evolucionado a partir de Mad Chair, un sillón de líneas armoniosas y envolventes perfecto también en la zona de noche. El sillón se puede tapizar eligiendo entre los tejidos y pieles del catálogo, con la posibilidad de combinar dos acabados diferentes para la carcasa exterior y el asiento interior, este último también con elaboración matelassé. Mad Chair está disponible con patas de madera o base giratoria de metal.","La collezione Mad si è evoluta a partire da Mad Chair, una poltrona dalle linee armoniche e avvolgenti perfetta anche nella zona notte. La poltrona si può rivestire scegliendo tra i tessuti e le pelli a catalogo, con possibilità di combinare tra loro due finiture diverse per scocca esterna e seduta interna, quest’ultima anche con lavorazione matelassé. Mad Chair è disponibile con gambe in essenza o basamento girevole in metallo."
69202,"MONDRIAN","Mondrian es una colección de sofás diseñada para el salón contemporáneo, un espacio acogedor que, según el momento del día y la ocasión, se presta a la conversación o al descanso. El conjunto se caracteriza por su diseño esencial y una imagen gráfica y moderna con un fuerte valor arquitectónico. Mondrian ofrece la máxima libertad de composición, con módulos que pueden combinarse libremente según el gusto y las necesidades. Las características patas metálicas sostienen una estructura minimalista diseñada para albergar una amplia gama de elementos, como cojines y reposabrazos, así como respaldos con estantes, mesas de centro y cajones de madera. En cuanto a la comodidad, se puede elegir entre dos profundidades de asiento para lograr la máxima relajación. El conjunto Mondrian se combina con la colección Mondrian de mesas de centro y consolas detrás del sofá.","Mondrian es una colección de sofás diseñada para el salón contemporáneo, un espacio acogedor que, según el momento del día y la ocasión, se presta a la conversación o al descanso. El conjunto se caracteriza por su diseño esencial y una imagen gráfica y moderna con un fuerte valor arquitectónico. Mondrian ofrece la máxima libertad de composición, con módulos que pueden combinarse libremente según el gusto y las necesidades. Las características patas metálicas sostienen una estructura minimalista diseñada para albergar una amplia gama de elementos, como cojines y reposabrazos, así como respaldos con estantes, mesas de centro y cajones de madera. En cuanto a la comodidad, se puede elegir entre dos profundidades de asiento para lograr la máxima relajación. El conjunto Mondrian se combina con la colección Mondrian de mesas de centro y consolas detrás del sofá."
69178,"CREEK","Creek è una collezione di tavolini di varie dimensioni, accomunati dal design composto da due vassoi sovrapposti appoggiati su una struttura di metallo. I colori e le finiture di ogni vassoio si possono abbinare a piacere, scegliendo tra colori laccati, legno, marmo e vetro per il vassoio superiore; colori laccati lucidi e opachi o legno per il vassoio inferiore.","Creek è una collezione di tavolini di varie dimensioni, accomunati dal design composto da due vassoi sovrapposti appoggiati su una struttura di metallo. I colori e le finiture di ogni vassoio si possono abbinare a piacere, scegliendo tra colori laccati, legno, marmo e vetro per il vassoio superiore; colori laccati lucidi e opachi o legno per il vassoio inferiore."
69163,"HOME HOTEL","El hilo conductor de las mesas de centro Home Hotel es la versatilidad. Las dos versiones, rectangular y cuadrada, están unidas por la tapa de madera, que adquiere ritmo gracias al particular juego de listones. Junto con las consolas y los bancos, las mesas de centro Home Hotel crean un sistema real, en el hogar y en las áreas de hostelería.","Il filo conduttore dei tavolini Home Hotel è la versatilità. Le due versioni, rettangolare e quadrata, sono accomunate dal piano in essenza, che acquista ritmo grazie al particolare gioco di listelli. Assieme a consolle e panche, i tavolini Home Hotel creano un vero e proprio sistema, in casa e nei luoghi dell’ospitalità."
68933,"TRAIL","El modelo Trail de Poliform es una reinterpretación contemporánea de la clásica puerta de marco. El elemento característico es el tirador integrado a lo largo de todo el ancho de la puerta. Un detalle estético de gran impacto visual, tanto cuando se utiliza en los muebles bajos como en los altos, también en combinación con las vitrinas.","El modelo Trail de Poliform es una reinterpretación contemporánea de la clásica puerta de marco. El elemento característico es el tirador integrado a lo largo de todo el ancho de la puerta. Un detalle estético de gran impacto visual, tanto cuando se utiliza en los muebles bajos como en los altos, también en combinación con las vitrinas."
69214,"WALLACE","Una propuesta con un diseño altamente innovador. Wallace es un sillón impresionante, con una base metálica de geometrías irregulares que soporta el envolvente marco de poliuretano recubierto de cuero. El asiento es llamativo y cómodo al mismo tiempo: atrae la mirada con su forma inusual y envuelve a la persona que se sienta en él en una comodidad única.","Una propuesta con un diseño altamente innovador. Wallace es un sillón impresionante, con una base metálica de geometrías irregulares que soporta el envolvente marco de poliuretano recubierto de cuero. El asiento es llamativo y cómodo al mismo tiempo: atrae la mirada con su forma inusual y envuelve a la persona que se sienta en él en una comodidad única."
69250,"MAD JOKER","En la extensa colección Mad, la elegante Mad Joker destaca por su respaldo alto, que la convierte en la silla de lectura perfecta. Complemento de las salas de estar más clásicas o más contemporáneas, Mad Joker se caracteriza por las líneas sinuosas y la calidad de la tapicería, que también se puede personalizar eligiendo dos acabados diferentes para la carcasa externa y el asiento interno. Mad Joker, que está disponible con patas de madera o base giratoria, se puede combinar con el puf.","Nell’ampia collezione Mad, l’elegante Mad Joker spicca per lo schienale alto, che la rende la perfetta poltrona da lettura. Complemento dei living più classici o più contemporanei, Mad Joker è caratterizzata dalle linee sinuose e dalla qualità del rivestimento, da personalizzare anche scegliendo due finiture diverse per scocca esterna e seduta interna. Mad Joker, che è disponibile con gambe in essenza o basamento girevole, si può accompagnare al pouf."
69208,"WESTSIDE","Westside es un sistema de sofá contemporáneo y multifuncional que reescribe con elegancia la experiencia de la sala de estar. Los módulos tapizados se colocan uno al lado del otro para crear las configuraciones más diversas, desde la isla de doble cara hasta el clásico sofá esquinero, mientras que elementos como la chaise longue ergonómica, el respaldo móvil y las mesas enriquecen su funcionalidad. Un arquetipo de convivencia, para ser diseñado y vivido libremente.&nbsp;","Westside è un sistema di divani contemporaneo e multifunzionale che riscrive con eleganza l’esperienza della zona living. I moduli imbottiti si affiancano tra loro per creare le più diverse configurazioni – dall’isola bifacciale al classico divano angolare – mentre gli elementi come la chaise longue ergonomica, lo schienale mobile e i tavolini ne arricchiscono la funzionalità. Un archetipo di convivialità, da progettare e vivere liberamente."
69157,"BRISTOL","Para completar la colección Bristol, compuesta por sofá, librería y aparador, se encuentran las mesas de centro para el centro de la sala, caracterizadas por dos tableros superpuestos. Los soportes de metal se cruzan con el piso superior, convirtiéndose en la firma estilística de toda la colección. La tapa inferior está disponible en lacado o madera, la superior también en mármol.","A completare la collezione Bristol, composta da divano, libreria e madia, ci sono i tavolini da centro stanza, caratterizzati da due piani sovrapposti. Sostegni in metallo intersecano il piano superiore, diventando la cifra stilistica dell’intera collezione. Il piano inferiore è disponibile in laccato o in essenza, quello superiore anche in marmo."
69247,"MAD QUEEN","Suave y tranquilizador, el sillón Mad Queen reinterpreta el concepto de la extensa serie Mad con volúmenes aún más cómodos. Lo caracterizan unas líneas sinuosas y una calidad absoluta de la tapicería, a elegir entre tejido y piel, combinando también diferentes acabados para la carcasa exterior y el asiento interior, este último también en la elegante versión Gibson matelassé. Aún más particular es la versión con pie de cuero, una variante preciosa y refinada para una colección impecable, en todas sus formas.","Suave y tranquilizador, el sillón Mad Queen reinterpreta el concepto de la extensa serie Mad con volúmenes aún más cómodos. Lo caracterizan unas líneas sinuosas y una calidad absoluta de la tapicería, a elegir entre tejido y piel, combinando también diferentes acabados para la carcasa exterior y el asiento interior, este último también en la elegante versión Gibson matelassé. Aún más particular es la versión con pie de cuero, una variante preciosa y refinada para una colección impecable, en todas sus formas."
69205,"BELLPORT","Líneas clásicas, patas elegantes y una inusual profundidad del asiento caracterizan el conjunto de sofás Bellport. Los distintos elementos tapizados pueden utilizarse para crear composiciones lineales o en forma de L, para lograr un confort realmente personalizado. Los reposabrazos están disponibles en versión alta o baja, y el cojín del asiento sigue siendo más ancho. La serie Bellport también incluye sofás fijos, camas de día, «chaises longues», pufs y centros de mesa, siempre con patas de metal, con o sin perfil, y siempre revestidos.","Líneas clásicas, patas elegantes y una inusual profundidad del asiento caracterizan el conjunto de sofás Bellport. Los distintos elementos tapizados pueden utilizarse para crear composiciones lineales o en forma de L, para lograr un confort realmente personalizado. Los reposabrazos están disponibles en versión alta o baja, y el cojín del asiento sigue siendo más ancho. La serie Bellport también incluye sofás fijos, camas de día, «chaises longues», pufs y centros de mesa, siempre con patas de metal, con o sin perfil, y siempre revestidos."
69160,"TRIBECA","Tribeca es un sistema de sofás y mesas de centro que se caracteriza por su base metálica y su rigurosa geometría. Las mesas de centro se completan con partes superiores en madera o mármol de diferentes tamaños y formas. El conjunto tiene carácter y elegancia y es ideal para ambientes con clase.","Tribeca es un sistema de sofás y mesas de centro que se caracteriza por su base metálica y su rigurosa geometría. Las mesas de centro se completan con partes superiores en madera o mármol de diferentes tamaños y formas. El conjunto tiene carácter y elegancia y es ideal para ambientes con clase."
68924,"ALEA PRO","Alea Pro, la reinterpretación del histórico y consolidado modelo Alea, se caracteriza por una expresividad más marcada. El diseño lineal del conjunto original se ha reinterpretado mediante una redefinición de los detalles, en particular las ranuras de apertura, enfatizadas por un contorno que resalta las líneas verticales y horizontales. El diseño de la puerta con el borde superior cónico y el perfil del tirador a juego con la forma es nuevo, al igual que el detalle del panel lateral espaciado, que confiere un aspecto más ligero a los muebles bajos. Las puertas de cristal de los muebles bajos, altos y de pared crean efectos de transparencia que dan ritmo a la composición. El resultado es un conjunto de cocina que combina una gran funcionalidad con un aspecto contemporáneo y que puede personalizarse con una gama muy amplia de materiales y acabados.","Alea Pro, la reinterpretación del histórico y consolidado modelo Alea, se caracteriza por una expresividad más marcada. El diseño lineal del conjunto original se ha reinterpretado mediante una redefinición de los detalles, en particular las ranuras de apertura, enfatizadas por un contorno que resalta las líneas verticales y horizontales. El diseño de la puerta con el borde superior cónico y el perfil del tirador a juego con la forma es nuevo, al igual que el detalle del panel lateral espaciado, que confiere un aspecto más ligero a los muebles bajos. Las puertas de cristal de los muebles bajos, altos y de pared crean efectos de transparencia que dan ritmo a la composición. El resultado es un conjunto de cocina que combina una gran funcionalidad con un aspecto contemporáneo y que puede personalizarse con una gama muy amplia de materiales y acabados."
69244,"MAD KING","Mad King es un sillón con asiento profundo y respaldo alto, también disponible en una versión asimétrica con bandeja opcional. Las posibilidades de tapizado son infinitas, con tejidos y pieles que además pueden combinarse entre sí eligiendo dos acabados diferentes para la carcasa exterior y el asiento interior. Elegante y envolvente, el sillón Mad King se puede utilizar solo o en pareja, en ambientes domésticos y contract.","Mad King è una poltrona con seduta profonda e schienale alto, disponibile anche in versione asimmetrica con vassoio opzionale. Infinite le possibilità di rivestimento, con tessuti e pelli anche da combinare tra loro scegliendo due finiture diverse per scocca esterna e seduta interna. Elegante e avvolgente, la poltrona Mad King può essere usata da sola o in coppia, in ambienti domestici e contract."
69262,"STANFORD LOUNGE","El sillón Stanford Lounge combina una base metálica giratoria con un asiento de respaldo alto, donde las líneas de la colección del mismo nombre se suavizan para tornarse más envolventes. Resulta particular la versión con tapicería de cuero, que se caracteriza por su exterior de cuero y su interior de cuero tono sobre tono.","El sillón Stanford Lounge combina una base metálica giratoria con un asiento de respaldo alto, donde las líneas de la colección del mismo nombre se suavizan para tornarse más envolventes. Resulta particular la versión con tapicería de cuero, que se caracteriza por su exterior de cuero y su interior de cuero tono sobre tono."
69190,"DUNE","Dune es un sistema de elementos acolchados con un aspecto suave y lleno. Muy versátil, permite crear infinidad de composiciones: sofás lineales, rinconeras, con chaise longue. Disponible en dos profundidades, grande y extragrande, Dune es la unión perfecta entre la sencillez formal y la libertad compositiva.","Dune è un sistema di elementi imbottiti dall’aspetto morbido e pieno. Molto versatile, permette di creare un numero infinito di composizioni – divani lineari, ad angolo, con chaise longue. Disponibile in due profondità, large ed extralarge, Dune è la la perfetta unione tra semplicità formale e libertà compositiva."
68931,"ALEA PRO","Alea Pro, la reinterpretación del histórico y consolidado modelo Alea, se caracteriza por una expresividad más marcada. El diseño lineal del conjunto original se ha reinterpretado mediante una redefinición de los detalles, en particular las ranuras de apertura, enfatizadas por un contorno que resalta las líneas verticales y horizontales. El diseño de la puerta con el borde superior cónico y el perfil del tirador a juego con la forma es nuevo, al igual que el detalle del panel lateral espaciado, que confiere un aspecto más ligero a los muebles bajos. Las puertas de cristal de los muebles bajos, altos y de pared crean efectos de transparencia que dan ritmo a la composición. El resultado es un conjunto de cocina que combina una gran funcionalidad con un aspecto contemporáneo y que puede personalizarse con una gama muy amplia de materiales y acabados.","Alea Pro, la reinterpretación del histórico y consolidado modelo Alea, se caracteriza por una expresividad más marcada. El diseño lineal del conjunto original se ha reinterpretado mediante una redefinición de los detalles, en particular las ranuras de apertura, enfatizadas por un contorno que resalta las líneas verticales y horizontales. El diseño de la puerta con el borde superior cónico y el perfil del tirador a juego con la forma es nuevo, al igual que el detalle del panel lateral espaciado, que confiere un aspecto más ligero a los muebles bajos. Las puertas de cristal de los muebles bajos, altos y de pared crean efectos de transparencia que dan ritmo a la composición. El resultado es un conjunto de cocina que combina una gran funcionalidad con un aspecto contemporáneo y que puede personalizarse con una gama muy amplia de materiales y acabados."
69241,"MAD CHAISE LONGUE","Un’eleganza sofisticata caratterizza Mad Chaise Longue, poltrona asimmetrica che si contraddistingue all’interno della serie Mad per comfort e dimensioni. Accurata e rigorosa la lavorazione, che si rivela nei dettagli come il piedino rivestito in pelle coordinato all’esterno della scocca. Come le altre poltrone della serie, anche per Mad Chaise Longue si può scegliere un rivestimento diverso per l’interno e l’esterno.","Un’eleganza sofisticata caratterizza Mad Chaise Longue, poltrona asimmetrica che si contraddistingue all’interno della serie Mad per comfort e dimensioni. Accurata e rigorosa la lavorazione, che si rivela nei dettagli come il piedino rivestito in pelle coordinato all’esterno della scocca. Come le altre poltrone della serie, anche per Mad Chaise Longue si può scegliere un rivestimento diverso per l’interno e l’esterno."
69199,"SYDNEY","Una contaminación de estilos, una mezcla de tendencias, un equilibrio perfecto entre líneas oblicuas y ortogonales, bordes afilados y redondeados: el diseño de Sydney transforma una serie de volúmenes geométricos en un sofá monocasco suave y cómodo. Sydney destaca por sus finos pies y los elementos en forma de L que componen el asiento, a completar con cojines libres de diferentes medidas y apoyabrazos opcional.","Una contaminazione di stili, un mix di tendenze, un equilibrio perfetto tra linee oblique e ortogonali, spigoli vivi e arrotondati: il design di Sydney trasforma una serie di volumi geometrici in un divano monoscocca morbido e confortevole. Sydney si riconosce per i piedini sottili e per gli elementi a L che costituiscono la seduta, da completare con cuscini liberi di diverse dimensioni e bracciolo opzionale."
69280,"SARA","Sara interpreta el espejo como pura esencialidad a través de la máxima limpieza de la superficie reflectante. El espejo, que puede colgarse o colocarse en el suelo con almohadillas de goma antideslizantes, está rodeado por un fino marco que da diferentes estilos según el acabado elegido: metálico, lacado o de cuero.","Sara interpreta el espejo como pura esencialidad a través de la máxima limpieza de la superficie reflectante. El espejo, que puede colgarse o colocarse en el suelo con almohadillas de goma antideslizantes, está rodeado por un fino marco que da diferentes estilos según el acabado elegido: metálico, lacado o de cuero."
69265,"STANFORD","La síntesis y la ligereza son las piedras angulares de la elegancia natural del sillón Stanford. Sobre la base metálica giratoria se levanta un asiento de líneas contemporáneas, acentuadas por la tapicería de tela o, en la versión de cuero, con exterior de cuero e interior de cuero tono sobre tono.","Sintesi e leggerezza sono i capisaldi della naturale eleganza della collezione di poltrone Stanford. Sulla base girevole in metallo si ergono linee rigorose, che si smussano nella poltrona con schienale alto Stanford Lounge. Particolare il rivestimento, con esterno in cuoio e interno in pelle tono su tono, con cuscino di seduta in pelle."
69187,"SHANGAI","Shangai es un sistema de sofás de formas rigurosas, disponible en dos versiones de acolchado, el primero más clásico y el segundo, en pluma, más suave e informal. La base de aluminio, que parece una fina línea, es un detalle de carácter con un toque contemporáneo.","Shangai è un sistema di divani dalle forme rigorose, declinato in due versioni di imbottitura – la prima più classica e la seconda, in piuma, più morbida e informale. Il basamento in alluminio, che sembra una linea sottile, è un dettaglio di carattere dal tocco contemporaneo."
68942,"ALEA","Grosor reducido, apertura de ranuras y máxima versatilidad en la elección de acabados: estas son las características que hacen que la puerta Alea sea única en cuanto a posibilidades de composición y personalización. Un diseño lineal compuesto por superficies planas y volúmenes geométricos, capaz de redefinir el entorno de la cocina combinando una alta funcionalidad con una estética minimalista.","Grosor reducido, apertura de ranuras y máxima versatilidad en la elección de acabados: estas son las características que hacen que la puerta Alea sea única en cuanto a posibilidades de composición y personalización. Un diseño lineal compuesto por superficies planas y volúmenes geométricos, capaz de redefinir el entorno de la cocina combinando una alta funcionalidad con una estética minimalista."
69325,"GENTLEMAN","Protagonista della Gentleman Night Collection è il letto, che riprende il mood e l’estetica della collezione giorno. La testiera, ampia e avvolgente, per le linee morbide e la qualità dei dettagli, come il gros-grain perimetrale, richiama il bavero alzato di una giacca. Il letto appoggia su un piedino in brown nickel o champagne, sottile ed elegante.","Protagonista della Gentleman Night Collection è il letto, che riprende il mood e l’estetica della collezione giorno. La testiera, ampia e avvolgente, per le linee morbide e la qualità dei dettagli, come il gros-grain perimetrale, richiama il bavero alzato di una giacca. Il letto appoggia su un piedino in brown nickel o champagne, sottile ed elegante."
69193,"PARIS SEOUL","Proporzioni generose per la collezione di divani Paris-Seoul. Un’estetica ultrabold per un archetipo dell’imbottito, che riconduce ogni elemento alla sua forma primaria. Una proposta elegante e completa per le atmosfere più classiche del living, capace di realizzare un comfort evoluto grazie al meccanismo per regolare a piacere la profondità della seduta.","Proporzioni generose per la collezione di divani Paris-Seoul. Un’estetica ultrabold per un archetipo dell’imbottito, che riconduce ogni elemento alla sua forma primaria. Una proposta elegante e completa per le atmosfere più classiche del living, capace di realizzare un comfort evoluto grazie al meccanismo per regolare a piacere la profondità della seduta."
69302,"CIRCLE","Circle es un espejo de pared en el que la perfección geométrica del círculo se une a la elegancia del marco de cuero para amueblar cualquier ambiente con sencillez.","Circle es un espejo de pared en el que la perfección geométrica del círculo se une a la elegancia del marco de cuero para amueblar cualquier ambiente con sencillez."
69126,"HENRY","Henry es una mesa de comedor extensible de notables dimensiones, diseñada para los momentos de convivencia. Acabados elegantes: la estructura, de madera maciza y caracterizada por una ebanistería refinada, se combina con la parte superior rectangular de madera, mármol o cristal.","Henry es una mesa de comedor moderna de generosas dimensiones, disponible en versión rectangular o cuadrada, siempre con esquinas redondeadas. Se inspira en la colección de mesas de centro Henry, de la que toma sus líneas sencillas y grosores reducidos con el fin de crear ambientes coordinados y coherentes. La estructura de madera maciza, caracterizada por una ebanistería refinada, se combina con la parte superior de cristal, mármol o madera. En las versiones de roble spessart, nogal dorado y olmo negro, el tablero es extensible para lograr la máxima funcionalidad."
