ID,post_title,post_content,post_excerpt
69181,"ORBIT","Orbit es una joya de elegancia y esencialidad que combina un saber hacer ancestral con una tecnología de producción avanzada. La mesa de centro reinterpreta el vidrio, un material técnico, mediante un diseño de líneas suaves y sinuosas. La parte superior redonda está soldada a la base cónica de vidrio soplado con una tecnología especial de rayos UV que no deja juntas visibles. Disponible en dos alturas, Orbit es visualmente ligera y minimalista, además de contar con un aspecto escultural. Una característica que la hace interactuar con cualquier ambiente, desde el más clásico hasta el más contemporáneo.","Orbit es una joya de elegancia y esencialidad que combina un saber hacer ancestral con una tecnología de producción avanzada. La mesa de centro reinterpreta el vidrio, un material técnico, mediante un diseño de líneas suaves y sinuosas. La parte superior redonda está soldada a la base cónica de vidrio soplado con una tecnología especial de rayos UV que no deja juntas visibles. Disponible en dos alturas, Orbit es visualmente ligera y minimalista, además de contar con un aspecto escultural. Una característica que la hace interactuar con cualquier ambiente, desde el más clásico hasta el más contemporáneo."
69151,"NARA","Mesa de centro o taburete, puf o mesita de noche, Nara es un mueble transversal que destaca por su sencillez. Disponible en dos medidas y realizada en madera maciza, la elaboración de la estructura está inspirada en el arte de la ebanistería, un detalle que es mucho más que una elección estética y habla del cuidado, la atención y el saber hacer de Poliform. Complemento ideal junto al sofá o sillón, en el dormitorio se convierte en una mesita de noche refinada y particular.","Tavolino o sgabello, pouf o comodino, Nara è un complemento d’arredo trasversale che spicca per la sua semplicità. È disponibile in due misure e realizzato in legno massello.La lavorazione della struttura è ispirata all’arte dell’ebanisteria, un dettaglio che è molto più di una scelta estetica e racconta la cura, l’attenzione e il saper fare di Poliform. Complemento ideale accanto al divano o alla poltrona, in camera da letto diventa un comodino ricercato e particolare."
68936,"MY PLANET","Con el modelo My Planet, Poliform reinterpreta la cocina contemporánea con practicidad y ligereza. Todo ello gracias a componentes como los tiradores, que pueden integrarse o aplicarse, y a una puerta más ligera que permite la máxima libertad a la hora de elegir los acabados. Detalles que determinan la singularidad de My Planet, un proyecto capaz de crear resultados compositivos originales y exclusivos incluso en espacios reducidos.","Con el modelo My Planet, Poliform reinterpreta la cocina contemporánea con practicidad y ligereza. Todo ello gracias a componentes como los tiradores, que pueden integrarse o aplicarse, y a una puerta más ligera que permite la máxima libertad a la hora de elegir los acabados. Detalles que determinan la singularidad de My Planet, un proyecto capaz de crear resultados compositivos originales y exclusivos incluso en espacios reducidos."
69011,"GENTLEMAN RELAX","Come suggerisce il nome, la poltrona Gentleman Relax è pensata per favorire i momenti di riposo, negli ambienti domestici e in quelli collettivi. Nelle linee morbide e nei caratteristici piedini a punta richiama il modello Gentleman Single, che reinterpreta con una profondità di seduta maggiore. La poltrona si può rivestire in pelle o tessuto, anche con bordura in gros-grain, e si può abbinare al pouf coordinato.","Come suggerisce il nome, la poltrona Gentleman Relax è pensata per favorire i momenti di riposo, negli ambienti domestici e in quelli collettivi. Nelle linee morbide e nei caratteristici piedini a punta richiama il modello Gentleman Single, che reinterpreta con una profondità di seduta maggiore. La poltrona si può rivestire in pelle o tessuto, anche con bordura in gros-grain, e si può abbinare al pouf coordinato."
68964,"COORDINATI LETTO","",""
68999,"GENTLEMAN&#8217;S FRIENDS","Completa la colección el modelo Gentleman's Friends, un moderno sofá de conversación disponible con dos o tres asientos. Al igual que los sillones, se caracteriza por una base de metal con patas delgadas, en diferentes acabados que se pueden personalizar según el tapizado de tela o cuero.","Completa la colección el modelo Gentleman's Friends, un moderno sofá de conversación disponible con dos o tres asientos. Al igual que los sillones, se caracteriza por una base de metal con patas delgadas, en diferentes acabados que se pueden personalizar según el tapizado de tela o cuero."
69059,"MATHIEU","Mathieu es un escritorio contemporáneo con una silueta elegante y contornos delicados. La parte superior, con marco de madera e inserción de cuero, presenta delicadas curvas que suavizan las fuertes líneas de la estructura metálica pintada. Los accesorios opcionales –el pequeño cajón bajo el estante y el espejo– son elegantes y discretos, por lo que resultan un complemento perfecto para la zona de descanso.","Mathieu es un escritorio contemporáneo con una silueta elegante y contornos delicados. La parte superior, con marco de madera e inserción de cuero, presenta delicadas curvas que suavizan las fuertes líneas de la estructura metálica pintada. Los accesorios opcionales –el pequeño cajón bajo el estante y el espejo– son elegantes y discretos, por lo que resultan un complemento perfecto para la zona de descanso."
69148,"FLUTE","Al igual que la mesa Flute, esta mesita luce una forma esbelta y limpia. Gracias a su sencillez y a la versatilidad de los numerosos colores y acabados disponibles, esta moderna mesita encaja con elegancia en cualquier contexto, junto al sofá o como mesita de noche en el dormitorio.","Al igual que la mesa Flute, esta mesita luce una forma esbelta y limpia. Gracias a su sencillez y a la versatilidad de los numerosos colores y acabados disponibles, esta moderna mesita encaja con elegancia en cualquier contexto, junto al sofá o como mesita de noche en el dormitorio."
68939,"TWELVE","El modelo Twelve es el resultado de una búsqueda extrema de la esencialidad. Una cocina de estética rigurosa, equilibrada entre el mínimo grosor y la máxima superficie, con la puerta más fina de la gama. La gran variedad de acabados y materiales disponibles –desde el vidrio hasta el acero– abre todas las posibilidades de interpretación estilística.","El modelo Twelve es el resultado de una búsqueda extrema de la esencialidad. Una cocina de estética rigurosa, equilibrada entre el mínimo grosor y la máxima superficie, con la puerta más fina de la gama. La gran variedad de acabados y materiales disponibles –desde el vidrio hasta el acero– abre todas las posibilidades de interpretación estilística."
68912,"JANE","Jane es un sofá de conversación para espacios domésticos y de hostelería. De la colección más grande, Jane incorpora las suaves curvas y la elegante combinación de base de madera o metal y asiento en tela o piel. ","La collezione di poltrone e poltroncine Jane si ispira a un’idea di eleganza, comfort e intimità. La serie, che si caratterizza per le curve morbide e le proporzioni equilibrate, si sviluppa a partire dalla poltroncina Jane. Dimensioni contenute e stile senza tempo ne fanno l’archetipo della collezione, da interpretare scegliendo differenti combinazioni materiche. Il basamento è in essenza o metallo e si abbina a tessuti o pelli che vestono la poltroncina come abiti haute couture."
68991,"UBIK","Ubik es un elegante armario vestidor basado en la combinación de paneles y un conjunto de estanterías. Evolucionado y ligero, ofrece tanto flexibilidad como funcionalidad, gracias a contenedores y accesorios como bandejas, cajones con frente de madera o cristal, zapateros extraíbles, pantaloneros y camiseros que pueden colocarse a la altura y en el orden deseados. La estructura del armario vestidor Ubik consiste en un conjunto de paneles de pared disponibles en diferentes acabados, que pueden combinarse o sustituirse por perfiles con estanterías, que a su vez se complementan con estantes y accesorios. Los acabados de los paneles definen la estética del armario vestidor: clásico en la versión con tapizado de madera, sofisticado en cristal, exclusivo en las versiones de tela y efecto «tecnocover». Hay dos acabados metálicos disponibles para el conjunto de estanterías: elegante pizarra y champán brillante.","Ubik es un elegante armario vestidor basado en la combinación de paneles y un conjunto de estanterías. Evolucionado y ligero, ofrece tanto flexibilidad como funcionalidad, gracias a contenedores y accesorios como bandejas, cajones con frente de madera o cristal, zapateros extraíbles, pantaloneros y camiseros que pueden colocarse a la altura y en el orden deseados. La estructura del armario vestidor Ubik consiste en un conjunto de paneles de pared disponibles en diferentes acabados, que pueden combinarse o sustituirse por perfiles con estanterías, que a su vez se complementan con estantes y accesorios. Los acabados de los paneles definen la estética del armario vestidor: clásico en la versión con tapizado de madera, sofisticado en cristal, exclusivo en las versiones de tela y efecto «tecnocover». Hay dos acabados metálicos disponibles para el conjunto de estanterías: elegante pizarra y champán brillante."
69259,"GENTLEMAN SINGLE","Gentleman es una colección de sillones, pufs y sofás que pueden utilizarse individualmente o combinarse para crear espacios de relajación en el hogar y en lugares públicos. La serie se desarrolló a partir de Gentleman Single, un sillón compacto que expresa el máximo confort en unas dimensiones reducidas. Las suaves curvas y las esbeltas patas acentúan su elegante porte, inspirado en el de los «gentlemen» de antaño. Tapizados en piel o tela, también con ribete de grosgrain.","Gentleman es una colección de sillones, pufs y sofás que pueden utilizarse individualmente o combinarse para crear espacios de relajación en el hogar y en lugares públicos. La serie se desarrolló a partir de Gentleman Single, un sillón compacto que expresa el máximo confort en unas dimensiones reducidas. Las suaves curvas y las esbeltas patas acentúan su elegante porte, inspirado en el de los «gentlemen» de antaño. Tapizados en piel o tela, también con ribete de grosgrain."
69110,"STANFORD BRIDGE","Un caparazón delgado y envolvente como un vestido descansa sobre una estructura delgada con una base giratoria. Stanford Bridge es la evolución natural del sillón Stanford: una silla moderna, con o sin reposabrazos, con una elegancia discreta y contemporánea. Tapizado en tela o piel, está diseñado para espacios domésticos pero también es ideal en el lugar de trabajo.","Un guscio sottile e avvolgente come un abito appoggia su un’esile struttura con base girevole. Stanford Bridge è la naturale evoluzione della poltrona Stanford: una sedia moderna, con o senza braccioli, dall’eleganza discreta e contemporanea. Rivestita in tessuto o pelle, è pensata per gli spazi di casa ma è ideale anche negli ambienti di lavoro."
69268,"JANE","La colección de sillas y sillones Jane se inspira en una idea de elegancia, confort e intimidad. La serie, que se caracteriza por sus suaves curvas y proporciones equilibradas, se desarrolla a partir del sillón Jane. Sus pequeñas dimensiones y su estilo atemporal lo convierten en el arquetipo de la colección, que se puede interpretar eligiendo diferentes combinaciones de materiales. La base es de madera o metal y se combina con telas o pieles que visten el sillón como si fuera un vestido de alta costura.","La colección de sillas y sillones Jane se inspira en una idea de elegancia, confort e intimidad. La serie, que se caracteriza por sus suaves curvas y proporciones equilibradas, se desarrolla a partir del sillón Jane. Sus pequeñas dimensiones y su estilo atemporal lo convierten en el arquetipo de la colección, que se puede interpretar eligiendo diferentes combinaciones de materiales. La base es de madera o metal y se combina con telas o pieles que visten el sillón como si fuera un vestido de alta costura."
69271,"JANE LARGE","Le stesse armoniose proporzioni della poltroncina Jane si ritrovano nei volumi generosi di Jane Large. Tra texture ispirate alla moda e pelli dal tocco morbido, spiccano la variante con bordura gros-grain e quella con rivestimento diverso tra interno ed esterno della scocca.","Le stesse armoniose proporzioni della poltroncina Jane si ritrovano nei volumi generosi di Jane Large. Tra texture ispirate alla moda e pelli dal tocco morbido, spiccano la variante con bordura gros-grain e quella con rivestimento diverso tra interno ed esterno della scocca."
69062,"FREE","Un monolito con formas geométricas estilizadas al estilo de Piet Mondrian para interpretarlo libremente y elegir entre todas las posibilidades que ofrecen los colores lacados mates y brillantes. En versión alta o baja, el aparador Free puede equiparse con accesorios opcionales, como un portacubiertos y un portabotellas.","Un monolito con formas geométricas estilizadas al estilo de Piet Mondrian para interpretarlo libremente y elegir entre todas las posibilidades que ofrecen los colores lacados mates y brillantes. En versión alta o baja, el aparador Free puede equiparse con accesorios opcionales, como un portacubiertos y un portabotellas."
69053,"HOME HOTEL","La elegancia y la versatilidad son el «fil rouge» de la colección Home Hotel, que reinterpreta los espacios de vida contemporáneos en clave de estilo de vida. En sus dos variantes, Home Hotel es tanto un escritorio sólido y a la vez ligero como una consola. Este moderno escritorio, elaborado en olmo negro, está disponible con o sin cajón y tablero de cuero.","La elegancia y la versatilidad son el «fil rouge» de la colección Home Hotel, que reinterpreta los espacios de vida contemporáneos en clave de estilo de vida. En sus dos variantes, Home Hotel es tanto un escritorio sólido y a la vez ligero como una consola. Este moderno escritorio, elaborado en olmo negro, está disponible con o sin cajón y tablero de cuero."
68982,"SENZAFINE ARMADIO","Senzafine es más que un armario, es un sistema que se enriquece continuamente con nuevas soluciones estéticas y funcionales. La estructura modular está diseñada para crear soluciones personalizadas, ideales para cualquier arquitectura. Laterales del marco, también en cristal, traseras, tapas, bases y estantes componen la estructura, a la que se suman diferentes tipos de puertas para sistemas de apertura batientes, correderas, coplanares o con cajones exteriores. Libertad sin límites para los acabados, desde la melamina hasta los acabados más preciados como el cristal que, aplicado en los laterales, traseras y puertas, crea vitrinas exclusivas. Cajoneras, equipamientos y accesorios completan una propuesta avanzada, capaz de adaptarse a cualquier espacio.","Senzafine è più di un armadio, è un sistema che si arricchisce continuamente di nuove soluzioni estetiche e funzionali. La struttura modulare è pensata per dare vita a soluzioni personalizzate, ideali per qualsiasi architettura. Fianchi a telaio, anche in vetro, schienali, coperchi, basamenti e ripiani costituiscono la struttura, cui si aggiungono diverse tipologie di anta per i sistemi di apertura battente, scorrevole, complanare o con cassetti esterni. Libertà senza limiti per le finiture, dai nobilitati alle finiture più preziose come il vetro che applicato a fianchi, schienali e ante crea esclusivi armadi teca. Cassettiere, attrezzature e accessori completano una proposta evoluta, in grado di adattarsi a ogni spazio."
69032,"HOME HOTEL","La colección Home Hotel se compone de una serie de elementos discretamente elegantes que pueden combinarse libremente entre sí. El propio nombre sugiere su gran versatilidad, que va desde el hogar hasta los locales de hostelería. El banco está disponible en diferentes alturas y tamaños, también con el asiento tapizado con cuerdas de cuero. El cojín es opcional, con una funda extraíble de tela o cuero. En la versión de piel de nobuck, la parte superior puede ser de piel tejida.","La colección Home Hotel se compone de una serie de elementos discretamente elegantes que pueden combinarse libremente entre sí. El propio nombre sugiere su gran versatilidad, que va desde el hogar hasta los locales de hostelería. El banco está disponible en diferentes alturas y tamaños, también con el asiento tapizado con cuerdas de cuero. El cojín es opcional, con una funda extraíble de tela o cuero. En la versión de piel de nobuck, la parte superior puede ser de piel tejida."
68967,"HENRY","Henry es un complemento ecléctico: puf, taburete y mesa de centro al mismo tiempo. El diseño recuerda las líneas de las sillas Grace y Sophie, con un esbelto armazón de madera maciza y un asiento blando, redondo o rectangular, con esquinas redondeadas, tapizado en tela o piel.","Henry es un complemento ecléctico: puf, taburete y mesa de centro al mismo tiempo. El diseño recuerda las líneas de las sillas Grace y Sophie, con un esbelto armazón de madera maciza y un asiento blando, redondo o rectangular, con esquinas redondeadas, tapizado en tela o piel."
69274,"JANE LOUNGE","Pensada para ambientes elegantes en los que labrarse espacios dedicados al confort y la intimidad, Jane Lounge se caracteriza por un respaldo alto, que combina comodidad y estética, convirtiéndola en la silla de lectura perfecta. Combinado con el puf, que recuerda las líneas de la serie, este sillón de estilo contemporáneo permite una relajación aún mayor.","Pensata per ambienti eleganti nei quali ritagliare spazi dedicati a comfort e intimità, Jane Lounge è caratterizzata dallo schienale alto, che coniuga comfort ed estetica rendendola la perfetta poltrona da lettura. Abbinata al pouf, che richiama le linee della serie, questa poltrona in stile contemporaneo consente un relax ancora maggiore."
68993,"SENZAFINE CABINA ARMADIO","La cabina armadio Senzafine reinterpreta il sistema armadio in modo leggero ed elegante senza rinunciare alla solidità, assicurata dai fianchi più spessi. Senza ante, i volumi di contenimento sono aperti e offrono la massima libertà di configurazione. Le finiture sono protagoniste, così come l’attrezzatura, da scegliere in base alle necessità combinando tubi appendiabiti, cassettiere, ripiani e vassoi estraibili. La cabina armadio si può completare con la cassettiera a isola Senzafine, perfettamente coordinata dal punto di vista estetico.","La cabina armadio Senzafine reinterpreta il sistema armadio in modo leggero ed elegante senza rinunciare alla solidità, assicurata dai fianchi più spessi. Senza ante, i volumi di contenimento sono aperti e offrono la massima libertà di configurazione. Le finiture sono protagoniste, così come l’attrezzatura, da scegliere in base alle necessità combinando tubi appendiabiti, cassettiere, ripiani e vassoi estraibili. La cabina armadio si può completare con la cassettiera a isola Senzafine, perfettamente coordinata dal punto di vista estetico."
69238,"SANTA MONICA","La poltrona Santa Monica ha forme avvolgenti e confortevoli, dettagli sartoriali e diversi rivestimenti disponibili, in pelle o tessuto. L’imbottitura in piuma le regala un aspetto piacevolmente informale.","La poltrona Santa Monica ha forme avvolgenti e confortevoli, dettagli sartoriali e diversi rivestimenti disponibili, in pelle o tessuto. L’imbottitura in piuma le regala un aspetto piacevolmente informale."
68985,"CÓMODA SENZAFINE","El modelo Senzafine es una cómoda de isla diseñada para completar con elegancia la zona del armario. Perfecta para colocarla el centro de la habitación, es muy versátil: la cómoda Poliform puede personalizarse en cuanto a tamaño y equipamiento, y así hacer coincidir los acabados con los del vestidor.","El modelo Senzafine es una cómoda de isla diseñada para completar con elegancia la zona del armario. Perfecta para colocarla el centro de la habitación, es muy versátil: la cómoda Poliform puede personalizarse en cuanto a tamaño y equipamiento, y así hacer coincidir los acabados con los del vestidor."
69232,"SANTA MONICA HOME","Sillón de lectura clásico con reposacabezas, Santa Monica Home destaca por sus formas suaves y llenas. El acolchado de plumas le da un aspecto elegantemente informal, que invita al relax. El sillón se puede tapizar en tela o piel.","Sillón de lectura clásico con reposacabezas, Santa Monica Home destaca por sus formas suaves y llenas. El acolchado de plumas le da un aspecto elegantemente informal, que invita al relax. El sillón se puede tapizar en tela o piel."
69065,"PANDORA","Pandora es una colección de aparadores de aspecto contemporáneo y versátil. Está disponible en cuatro modelos, todos ellos caracterizados por la combinación de puertas y cajones y patas metálicas originales. Las posibilidades estéticas son casi infinitas, con una estructura y unas puertas que se pueden personalizar eligiendo entre todos los colores lacados mates y brillantes y diferentes tipos de madera.","Pandora es una colección de aparadores de aspecto contemporáneo y versátil. Está disponible en cuatro modelos, todos ellos caracterizados por la combinación de puertas y cajones y patas metálicas originales. Las posibilidades estéticas son casi infinitas, con una estructura y unas puertas que se pueden personalizar eligiendo entre todos los colores lacados mates y brillantes y diferentes tipos de madera."
69056,"CONCORDE","Las formas ligeras y minimalistas de la mesa Concorde se reinterpretan en forma de escritorio, un complemento esencial para crear un espacio que sirva de estudio en casa. Una cuidada selección de materiales, como la madera maciza y los finos acabados. Concorde está disponible con o sin cajón y tablero de cuero.","Las formas ligeras y minimalistas de la mesa Concorde se reinterpretan en forma de escritorio, un complemento esencial para crear un espacio que sirva de estudio en casa. Una cuidada selección de materiales, como la madera maciza y los finos acabados. Concorde está disponible con o sin cajón y tablero de cuero."
69035,"PARK","El banco Park es un complemento diseñado para acompañar a la cama del mismo nombre, a la que recuerda en sus líneas ligeras y contemporáneas. La estructura metálica, también en su versión tapizada, soporta un suave cojín de tela o cuero, a juego con el acabado de la cama.","El banco Park es un complemento diseñado para acompañar a la cama del mismo nombre, a la que recuerda en sus líneas ligeras y contemporáneas. La estructura metálica, también en su versión tapizada, soporta un suave cojín de tela o cuero, a juego con el acabado de la cama."
69113,"SOPHIE LITE","La silla Sophie Lite es la evolución contemporánea y ligera del histórico modelo Sophie. Se mantiene la estructura de madera maciza, mientras que el asiento se distingue por el respaldo perfilado, tapizado en tejido o piel. Acogedora y elegante, Sophie Lite representa el nuevo complemento perfecto para todas las mesas de la colección Day Complements.","La sedia Sophie Lite è l’evoluzione contemporanea e leggera dello storico modello Sophie. Resta la struttura in legno massello, mentre la seduta si distingue per lo schienale sagomato, rivestito in tessuto o pelle. Accogliente ed elegante, Sophie Lite rappresenta il nuovo, perfetto completamento di tutti i tavoli della collezione Day Complements."
69226,"IPANEMA","Ipanema es un sillón moderno, refinado y confortable con una gran versatilidad. El diseño esencial de la estructura se combina con la atención al confort, con cojines de apoyo o estructura revestida en tejido o piel. Ipanema también está disponible en versión silla, para crear espacios coordinados desde el punto de vista del gusto y el estilo.","Ipanema è una poltrona moderna, raffinata e confortevole, dalla grande versatilità. Il design essenziale della struttura si combina con l’attenzione per la comodità, con cuscini in appoggio o struttura rivestita in tessuto o pelle. Ipanema è disponibile anche in versione sedia, per creare spazi coordinati dal punto di vista del gusto e dello stile."
68988,"SET UP","Una joya de la elegancia, la cómoda de isla Set-Up cuenta con una parte superior de cristal y compartimentos abiertos, que muestran y protegen al mismo tiempo. Ideal en el centro del vestidor, el modelo Set-Up presenta un acabado por los cuatro costados y es precioso por sus finos remates.","Una joya de la elegancia, la cómoda de isla Set-Up cuenta con una parte superior de cristal y compartimentos abiertos, que muestran y protegen al mismo tiempo. Ideal en el centro del vestidor, el modelo Set-Up presenta un acabado por los cuatro costados y es precioso por sus finos remates."
69229,"MARLON","La fuerte personalidad del sillón Marlon deriva de la combinación de la base de madera y el cuerpo del asiento ergonómico. Un proyecto que habla un lenguaje moderno y sofisticado.","La fuerte personalidad del sillón Marlon deriva de la combinación de la base de madera y el cuerpo del asiento ergonómico. Un proyecto que habla un lenguaje moderno y sofisticado."
