ID,post_title,post_content,post_excerpt
116132,"LEXINGTON","Lexington es un sistema con fuertes connotaciones arquitectónicas. Se caracteriza por los montantes en el techo o en la pared, en los que se fijan a la altura deseada estantes y unidades de almacenamiento con puertas abatibles, cajones o puertas desplegables. El montante está disponible en acabado barnizado en color champagne o ardesia, o en roble gold y olmo nero, que aporta una sensación más cálida. En la versión con montante de techo, el sistema ofrece la posibilidad de diseñar composiciones de doble cara acabadas por ambos lados, ideales en el centro de la habitación y también para dividir el espacio. Lexington también está disponible en versión dormitorio.","Lexington es un sistema con fuertes connotaciones arquitectónicas. Se caracteriza por los montantes en el techo o en la pared, en los que se fijan a la altura deseada estantes y unidades de almacenamiento con puertas abatibles, cajones o puertas desplegables. El montante está disponible en acabado barnizado en color champagne o ardesia, o en roble gold y olmo nero, que aporta una sensación más cálida. En la versión con montante de techo, el sistema ofrece la posibilidad de diseñar composiciones de doble cara acabadas por ambos lados, ideales en el centro de la habitación y también para dividir el espacio. Lexington también está disponible en versión dormitorio."
69196,"BRISTOL","El confort envolvente de los cojines y la ligereza de los brazos distinguen la estética de Bristol, un sistema de sofás contemporáneo que ofrece la máxima versatilidad compositiva, entre diseño esencial y proporciones generosas. Disponible con cojines simples, dobles o libres, el sofá Bristol se puede enriquecer con elementos accesorios como las mesas de centro Bristol System, el reposacabezas, el escritorio, para crear áreas de relajación en línea con sus necesidades y personalidad.","Il comfort avvolgente della cuscinatura e la leggerezza dei braccioli contraddistinguono l'estetica di Bristol, un sistema di divani contemporaneo che offre la massima versatilità compositiva, fra essenzialità del disegno e proporzioni generose. Disponibile con cuscinatura semplice, doppia o libera, il divano Bristol si può arricchire con elementi accessori come i tavolini Bristol System, il poggiatesta, il piano scrittoio – per creare zone relax in linea con le proprie esigenze e personalità."
69253,"KAY LOUNGE","Elegante, ligero y esencial, Kay Lounge es un sillón con una modernidad innata. Presenta una estructura lineal de inspiración arquitectónica en metal satinado o barnizado en marrón. El asiento y el respaldo, amplios, cómodos y acogedores, están disponibles en tres acabados de cuero con bordes bien definidos, cuero y tela, así como en cuero con pelo y cuero tejido, tapicerías seleccionadas exclusivamente para este modelo. Gracias a sus líneas contemporáneas y su distintivo tapizado, Kay Lounge destaca en cualquier contexto: solo o con el característico reposapiés, como complemento de grandes salones o espacios comunes, es un sillón que reinterpreta los gustos y exigencias más actuales, a caballo entre el diseño y el confort.","Elegante, ligero y esencial, Kay Lounge es un sillón con una modernidad innata. Presenta una estructura lineal de inspiración arquitectónica en metal satinado o barnizado en marrón. El asiento y el respaldo, amplios, cómodos y acogedores, están disponibles en tres acabados de cuero con bordes bien definidos, cuero y tela, así como en cuero con pelo y cuero tejido, tapicerías seleccionadas exclusivamente para este modelo. Gracias a sus líneas contemporáneas y su distintivo tapizado, Kay Lounge destaca en cualquier contexto: solo o con el característico reposapiés, como complemento de grandes salones o espacios comunes, es un sillón que reinterpreta los gustos y exigencias más actuales, a caballo entre el diseño y el confort."
69277,"LE CLUB","El sillón Le Club reinterpreta en clave contemporánea uno de los arquetipos del diseño del siglo pasado, el voluminoso sillón club de piel, hecho más actual, ligero y esencial. Le Club conserva las líneas curvas y el confort inigualable de los sillones que lo inspiran, pero aligera el volumen en nombre de una elegancia más casual y contemporánea, que recuerda las formas del diseño de los años setenta. La tapicería, en tejido o piel, no es desenfundable: adhiriéndose perfectamente a la estructura de acero con asiento en poliuretano moldeado flexible, es uno con el diseño de la silla, demostrando la más alta calidad de ejecución.","La poltrona Le Club reinterpreta in chiave contemporanea uno degli archetipi del design del secolo scorso, la voluminosa poltrona in cuoio dei club, resa più attuale, leggera ed essenziale. Le Club conserva le linee curve e il comfort ineguagliabile delle poltrone a cui si ispira, ma ne alleggerisce il volume all’insegna di un’eleganza più disinvolta e contemporanea, che richiama le forme del design anni Settanta. Il rivestimento, in tessuto o pelle, non è sfoderabile: aderendo perfettamente alla struttura, in acciaio con seduta in poliuretano flessibile stampato, è tutt’uno con il design della poltrona, a dimostrazione di un’altissima qualità di esecuzione."
68951,"SHAPE","Shape es una cocina contemporánea que combina la funcionalidad de las puertas con tirador con la estética esencial de las que no lo tienen. En los muebles bajos, el perfil del tirador se integra en el centro de la puerta o en el lateral, mientras que en los muebles altos adquiere el aspecto de una moldura a lo largo de toda la pieza. Shape se completa con elementos y accesorios pensados para mejorar la experiencia de quien hace vida en la cocina todos los días, como la encimera con cubeta integrada y voladizo con pata Minus, la campana Infinity con función de iluminación y aspiración, los módulos de luz y fotorreceptores con vitrina y la mesa de snack Moon con una superficie giratoria. Una cocina moderna con una exclusiva selección de materiales.","Shape es una cocina contemporánea que combina la funcionalidad de las puertas con tirador con la estética esencial de las que no lo tienen. En los muebles bajos, el perfil del tirador se integra en el centro de la puerta o en el lateral, mientras que en los muebles altos adquiere el aspecto de una moldura a lo largo de toda la pieza. Shape se completa con elementos y accesorios pensados para mejorar la experiencia de quien hace vida en la cocina todos los días, como la encimera con cubeta integrada y voladizo con pata Minus, la campana Infinity con función de iluminación y aspiración, los módulos de luz y fotorreceptores con vitrina y la mesa de snack Moon con una superficie giratoria. Una cocina moderna con una exclusiva selección de materiales."
69044,"FRAME","Frame es una alfombra contemporánea hecha de seda de bambú, material que le da su característico aspecto iridiscente. Disponible en versión ovalada o rectangular, esta variante presenta un borde monocromático de lana del Himalaya del mismo color.","Frame es una alfombra contemporánea hecha de seda de bambú, material que le da su característico aspecto iridiscente. Disponible en versión ovalada o rectangular, esta variante presenta un borde monocromático de lana del Himalaya del mismo color."
68921,"LEXINGTON","Lexington è un sistema notte a montanti disponibile in due configurazioni: a parete oppure a soffitto, in questo caso con possibilità di progettare composizioni bifacciali finite su entrambi i lati. Ai montanti in finitura verniciato champagne o ardesia si agganciano ripiani, cassettiere e un’ampia gamma di attrezzature – le stesse del sistema Senzafine. Disponibile anche in versione sistema giorno, per l’infinita flessibilità in termini di dimensioni, contesti d’uso e finiture, Lexington segna un’evoluzione nel mondo dei sistemi, nell’ottica di un’integrazione totale tra i diversi ambienti della casa.","Lexington è un sistema notte a montanti disponibile in due configurazioni: a parete oppure a soffitto, in questo caso con possibilità di progettare composizioni bifacciali finite su entrambi i lati. Ai montanti in finitura verniciato champagne o ardesia si agganciano ripiani, cassettiere e un’ampia gamma di attrezzature – le stesse del sistema Senzafine. Disponibile anche in versione sistema giorno, per l’infinita flessibilità in termini di dimensioni, contesti d’uso e finiture, Lexington segna un’evoluzione nel mondo dei sistemi, nell’ottica di un’integrazione totale tra i diversi ambienti della casa."
69047,"PLAIN","Rectangular o redonda, la alfombra Plain está hecha de una mezcla de aloe y seda de bambú, dos materiales muy resistentes y de excelente calidad. Disponible en cinco colores, se caracteriza en ambas versiones por las secciones más oscuras, en el mismo color.","Rettangolare o tondo, il tappeto Plain è realizzato in un blend di aloe e seta di bambù, due materiali molto resistenti e di qualità eccellente. Disponibile in cinque colori, è caratterizzato in entrambe le versioni dalle sezioni più scure, in tinta."
68918,"DROP","Elegante y precioso, Drop es un espejo redondo de generosas dimensiones. Se caracteriza por el marco de cuero, que incorpora la correa con la que se cuelga en la pared.","Elegante y precioso, Drop es un espejo redondo de generosas dimensiones. Se caracteriza por el marco de cuero, que incorpora la correa con la que se cuelga en la pared."
69050,"SOFT","En la alfombra Soft se tejen 25 tonos diferentes de gris, que se reconocen por sus matices y el aspecto iridiscente de la seda de bambú. De forma rectangular, Soft es una alfombra contemporánea, suave y refinada.","En la alfombra Soft se tejen 25 tonos diferentes de gris, que se reconocen por sus matices y el aspecto iridiscente de la seda de bambú. De forma rectangular, Soft es una alfombra contemporánea, suave y refinada."
68970,"RELIEF","La alfombra Relief combina un efecto acanalado con una decoración perimetral gracias al corte del pelo a diferentes alturas. Disponible en color perla, camel y gris tórtola, está fabricada con una mezcla de lana del Himalaya y seda de bambú, una combinación que acentúa la suavidad y el tacto.","La alfombra Relief combina un efecto acanalado con una decoración perimetral gracias al corte del pelo a diferentes alturas. Disponible en color perla, camel y gris tórtola, está fabricada con una mezcla de lana del Himalaya y seda de bambú, una combinación que acentúa la suavidad y el tacto."
69038,"DAMA","La alfombra Dama se reconoce por su estampado de cuadros, un patrón que puede aportar un toque vivo y a la vez elegante a cualquier habitación. El tejido de los hilos es de algodón, mientras que el del pelo es de lana del Himalaya en tonos naturales y seda de bambú negra.","La alfombra Dama se reconoce por su estampado de cuadros, un patrón que puede aportar un toque vivo y a la vez elegante a cualquier habitación. El tejido de los hilos es de algodón, mientras que el del pelo es de lana del Himalaya en tonos naturales y seda de bambú negra."
69175,"HENRY","Henry es una colección de elegantes mesas de centro de estética lineal, con tapa de mármol o cristal y estructura de madera. Disponibles en varias formas y tamaños, se pueden usar individualmente o en combinación.","Henry è una collezione di tavolini eleganti dall’estetica lineare, con piano in marmo o vetro e struttura in essenza. Disponibili di varie forme e dimensioni, possono essere usati singolarmente o in combinazione."
68928,"CANNELÉ","El «cannelé» es una alfombra bicolor con un patrón de rayas. Las rayas se definen con mayor precisión por la yuxtaposición de dos tipos de elaboración: el «bouclé» para el negro y el vellón cortado a mano para el perla. El tejido es de algodón, el pelo de lana del Himalaya y seda de bambú y el «bouclé» de lana del Himalaya. La alfombra está hecha a mano con la técnica tradicional del telar manual.","El «cannelé» es una alfombra bicolor con un patrón de rayas. Las rayas se definen con mayor precisión por la yuxtaposición de dos tipos de elaboración: el «bouclé» para el negro y el vellón cortado a mano para el perla. El tejido es de algodón, el pelo de lana del Himalaya y seda de bambú y el «bouclé» de lana del Himalaya. La alfombra…"
69041,"STRIPES","Stripes es una alfombra de rayas, un clásico atemporal de la colección Poliform. Las rayas negras son de seda de bambú, mientras que las de tonos naturales son de lana del Himalaya.","Stripes es una alfombra de rayas, un clásico atemporal de la colección Poliform. Las rayas negras son de seda de bambú, mientras que las de tonos naturales son de lana del Himalaya."
68926,"SYMPHONY","Symphony es una colección de aparadores donde la esencialidad de las líneas se expresa a través de materiales nobles y una mano de obra precisa. Los aparadores se caracterizan por una forma elíptica, realzada por el acabado en madera. La colección incluye elementos de diferentes alturas y tamaños, desde las versiones altas y medianas con puertas hasta la versión baja con cajones o con cajón y compartimiento abierto, todo sobre una base con pies.","Symphony es una colección de aparadores donde la esencialidad de las líneas se expresa a través de materiales nobles y una mano de obra precisa. Los aparadores se caracterizan por una forma elíptica, realzada por el acabado en madera. La colección incluye elementos de diferentes alturas y tamaños, desde las versiones altas y medianas con…"
68948,"PHOENIX","Fruto de la intuición del diseño de Poliform, Phoenix es una cocina que invita a la libertad creativa. Esto se debe al diseño especial de la apertura de la ranura, que transforma un detalle técnico como el tirador, fundamental para mejorar la experiencia del usuario en la cocina, en un detalle estético. Además de la practicidad de la apertura y el manejo de la puerta, el aspecto lineal del tirador le aporta un estilo ligero y contemporáneo a la composición. Phoenix es uno de los modelos de cocina más populares entre los diseñadores, que aprecian su flexibilidad y la posibilidad de personalizar el diseño y los acabados.","Fruto de la intuición del diseño de Poliform, Phoenix es una cocina que invita a la libertad creativa. Esto se debe al diseño especial de la apertura de la ranura, que transforma un detalle técnico como el tirador, fundamental para mejorar la experiencia del usuario en la cocina, en un detalle estético. Además de la practicidad de la apertura y el manejo de la puerta, el aspecto lineal del tirador le aporta un estilo ligero y contemporáneo a la composición. Phoenix es uno de los modelos de cocina más populares entre los diseñadores, que aprecian su flexibilidad y la posibilidad de personalizar el diseño y los acabados."
68973,"TRATTO","Tratto è un tappeto dal design contemporaneo, realizzato in un blend di lana himalayana, morbida al tatto, e seta di bambù, che lo rende cangiante. È caratterizzato dai motivi geometrici e disponibile in tre vibranti combinazioni di colore: ruggine su base tortora, carbone su base tortora e tortora su base carbone, nelle varianti quadrata e rettangolare.","Tratto è un tappeto dal design contemporaneo, realizzato in un blend di lana himalayana, morbida al tatto, e seta di bambù, che lo rende cangiante. È caratterizzato dai motivi geometrici e disponibile in tre vibranti combinazioni di colore: ruggine su base tortora, carbone su base tortora e tortora su base carbone, nelle varianti quadrata e rettangolare."
69154,"SOORI","Inspirada en Bali y su cultura, y en particular en los jarrones tradicionales utilizados en los pueblos de la paradisíaca isla indonesia, Soori es una mesa de centro con una estética original y reconocible que destaca tanto en el salón como en el dormitorio. Está disponible en tres tamaños en metal con acabado de bronce antiguo y, en el caso de la más pequeña, también en lacado brillante y mate.","Inspirada en Bali y su cultura, y en particular en los jarrones tradicionales utilizados en los pueblos de la paradisíaca isla indonesia, Soori es una mesa de centro con una estética original y reconocible que destaca tanto en el salón como en el dormitorio. Está disponible en tres tamaños en metal con acabado de bronce antiguo y, en el caso de la más pequeña, también en lacado brillante y mate."
69211,"SAINT-GERMAIN","Saint-Germain es un sistema de sofás con formas sinuosas y sensuales. Inspirado en formas orgánicas que recuerdan el diseño de los años setenta, transforma cualquier espacio en un paisaje cálido y familiar, infundiendo una agradable sensación de confort en el hogar. Líneas suaves y envolventes se repiten en todos los elementos de la colección, que incluye diferentes módulos con los que crear composiciones lineales, angulares o de formas insólitas, caracterizadas siempre por juegos de formas y profundidades con un aspecto acogedor. Desde la materialidad de alta costura de los tejidos bouclé hasta la elegancia contemporánea del cuero, la tapicería realza los volúmenes llenos y voluptuosos de Saint-Germain, haciendo que su estética sea transversal.","Saint-Germain è un sistema di divani dalle forme sinuose e sensuali. Ispirato a forme organiche che richiamano il design anni Settanta, trasforma qualsiasi spazio in un paesaggio caldo e familiare, infondendo una piacevole sensazione di comfort domestico. Linee morbide e avvolgenti ricorrono in tutti gli elementi della collezione, che comprende diversi moduli con cui realizzare composizioni lineari, angolari o di forme insolite, sempre caratterizzate da giochi di forme e profondità dall’aspetto accogliente. Dalla matericità haute couture dei tessuti bouclé all’eleganza contemporanea della pelle, il rivestimento valorizza i volumi pieni e voluttuosi di Saint-Germain, rendendo la sua estetica trasversale."
69008,"GENTLEMAN RESERVED","Dentro de la colección Gentleman, el sillón Gentleman Reserved es el más característico. Su respaldo alto con botones recuerda al mundo de los «cigar club». Lo que hace que este modelo sea aún más exclusivo es la posibilidad de combinar dos acabados diferentes para el revestimiento interior y exterior. Gentleman Reserved puede completarse con el puf, un accesorio útil y elegante que aumenta su comodidad.","Dentro de la colección Gentleman, el sillón Gentleman Reserved es el más característico. Su respaldo alto con botones recuerda al mundo de los «cigar club». Lo que hace que este modelo sea aún más exclusivo es la posibilidad de combinar dos acabados diferentes para el revestimiento interior y exterior. Gentleman Reserved puede completarse con el puf, un accesorio útil y elegante que aumenta su comodidad."
69172,"ILDA","Las mesas de centro Ilda son auténticas joyas porque la estructura portante es una fusión de latón, oro pulido o bronceado, forjada en una fundición artística y acabada a mano. Las tapas son de mármol, ónix ámbar o lapislázuli. Un proyecto precioso, de gran impacto visual, en la zona de estar o reinterpretado como mesita de noche en la zona de noche.","I tavolini Ilda sono veri e propri gioielli perché la struttura portante è una fusione di ottone, lucidata oro o bronzata, forgiata in una fonderia artistica e rifinita a mano. I piani sono in marmo, onice ambra o lapislazzuli. Un progetto prezioso, di grande impatto visivo, nella zona giorno o reinterpretato come comodino nella zona notte."
69145,"DAMA","Dama es una mesita con una estética minimalista y muy reconocible: cálida y familiar en la versión de cedro o nogal Canaletto, se convierte en monolítica y contemporánea en la versión lacada brillante o mate. Este elemento inspirado en la máxima sencillez también resulta muy transversal, ya que es un tablero práctico apto para cualquier habitación de la casa.","Dama es una mesita con una estética minimalista y muy reconocible: cálida y familiar en la versión de cedro o nogal Canaletto, se convierte en monolítica y contemporánea en la versión lacada brillante o mate. Este elemento inspirado en la máxima sencillez también resulta muy transversal, ya que es un tablero práctico apto para cualquier habitación de la casa."
69184,"KOISHI","Las mesas de centro Koishi están inspiradas en líneas suaves y formas orgánicas. El propio nombre - Koishi, que en japonés significa 'guijarro' - alude a una naturalidad que también se expresa en la elección de materiales naturales como el mármol, la piedra y la madera. La estructura metálica es escultórica pero esencial; madera, vidrio y mármol son los materiales disponibles para la tapa.","I tavolini Koishi sono ispirati a linee morbide e forme organiche. Il nome stesso – Koishi, che in giapponese significa “ciottolo” – allude a una naturalità che si esprime anche nella scelta di materiali naturali come marmi, pietre ed essenze. La struttura in metallo è scultorea ma essenziale; essenza, vetro e marmo sono invece i materiali disponibili per il piano."
69142,"BABA","Baba es una mesa de centro que completa el salón con estilo y elegancia, pues está diseñada para que la base se pueda ocultar bajo el sofá y así disfrutar de la parte superior con mayor comodidad. Versátil e informal, se caracteriza por una estructura metálica pintada o lacada mate y una parte superior de mármol, cristal y todos los colores de la gama lacada mate o brillante.","Baba es una mesa de centro que completa el salón con estilo y elegancia, pues está diseñada para que la base se pueda ocultar bajo el sofá y así disfrutar de la parte superior con mayor comodidad. Versátil e informal, se caracteriza por una estructura metálica pintada o lacada mate y una parte superior de mármol, cristal y todos los colores de la gama lacada mate o brillante."
69166,"MONDRIAN","Una colección con una imagen elegante y ligera, con esbeltas encimeras de madera, mármol o en acabados lacados brillantes y mates. Disponibles en dos alturas y diferentes formas para facilitar la combinación de varios elementos, estas mesas de centro con base metálica son fáciles de insertar en el salón y perfectas en combinación con el conjunto de sofás Mondrian.","Una colección con una imagen elegante y ligera, con esbeltas encimeras de madera, mármol o en acabados lacados brillantes y mates. Disponibles en dos alturas y diferentes formas para facilitar la combinación de varios elementos, estas mesas de centro con base metálica son fáciles de insertar en el salón y perfectas en combinación con el conjunto de sofás Mondrian."
69139,"PARIS SEOUL","La mesita también forma parte de la extensa colección Paris Seoul. Con su estructura de metal y la parte exterior de cuero, puede colocarse cerca de los sofás y sillones para tener a mano lo que se necesite.","La mesita también forma parte de la extensa colección Paris Seoul. Con su estructura de metal y la parte exterior de cuero, puede colocarse cerca de los sofás y sillones para tener a mano lo que se necesite."
69235,"SANTA MONICA LOUNGE","La elegancia de la colección Santa Monica también se materializa en la versión Lounge del sillón, con respaldo alto y puf coordinado. Tapizado en tela o piel, está enriquecido con detalles de sastrería como el dobladillo plisado con ranas, las costuras de cordón y el borde de grosgrain.","L’eleganza della collezione Santa Monica si sostanzia anche nella poltrona in versione Lounge, con schienale alto e pouf coordinato. Rivestita in tessuto o pelle, è arricchita da dettagli sartoriali come il fondopiega con alamari, la cucitura a cordoncino e la bordatura in gros-grain."
68945,"ARTEX","Artex es la cocina de los ambientes más exclusivos. Las grandes superficies y los volúmenes esenciales hacen que los materiales sean los protagonistas absolutos, realzados por la confección de la puerta, en versión lisa o de lamas. El estrechamiento especial en la apertura, el lateral y la parte superior crea una unión perfecta entre los elementos, combinando la practicidad de la apertura con una estética impecable. Entre los modelos históricos de Poliform, Artex presenta un espíritu contemporáneo que realzan los acabados constantemente renovados. De hecho, es la cocina que ofrece –en su versión con puerta lisa– la mayor variedad de acabados, incluyendo los más solicitados como el nogal Canaletto macizo, el roble pantano macizo, el DuPont Corian® giacer white, el acero scotch brite y el cristal.","Artex es la cocina de los ambientes más exclusivos. Las grandes superficies y los volúmenes esenciales hacen que los materiales sean los protagonistas absolutos, realzados por la confección de la puerta, en versión lisa o de lamas. El estrechamiento especial en la apertura, el lateral y la parte superior crea una unión perfecta entre los elementos, combinando la practicidad de la apertura con una estética impecable. Entre los modelos históricos de Poliform, Artex presenta un espíritu contemporáneo que realzan los acabados constantemente renovados. De hecho, es la cocina que ofrece –en su versión con puerta lisa– la mayor variedad de acabados, incluyendo los más solicitados como el nogal Canaletto macizo, el roble pantano macizo, el DuPont Corian® giacer white, el acero scotch brite y el cristal."
